{"canonical_ntriples_sha256":"98a1b513e69367b9ad5cbc0bacbce9c2d7bba07e7455bb50c07851c0ece249d7","contract_version":"1.0","forbidden_assertion_count":1,"projection_record_count":1,"records":[{"candidate_kind":"ENTITY","canonical_ntriples_line":"<https://yangjunjie-lin.github.io/KG-MNP-Demo/data/modeled/3c57cca129580c393bb6994fbf088209879907efde712279eb6de9986ba6d457> <http://www.w3.org/1999/02/22-rdf-syntax-ns#type> <https://yangjunjie-lin.github.io/KG-MNP-Demo/ontology/terms#Subscriber> .","decision_id":"urn:kg-mnp:review-decision:c6886f8af15203ea99b3ccea628d8de4458f8ce9297a12c2b9dc8ea8f748f4ea","decision_outcome":"REJECT","effective_candidate_id":"urn:kg-mnp:candidate:d34f2db397b76e7e026a66d34d3953cf3891b2b1fe99135ce4b68810511cece8","object":{"term_type":"IRI","value":"https://yangjunjie-lin.github.io/KG-MNP-Demo/ontology/terms#Subscriber"},"predicate":"http://www.w3.org/1999/02/22-rdf-syntax-ns#type","projection_status":"PROJECTED","reason":null,"source_candidate_id":"urn:kg-mnp:candidate:d34f2db397b76e7e026a66d34d3953cf3891b2b1fe99135ce4b68810511cece8","subject":"https://yangjunjie-lin.github.io/KG-MNP-Demo/data/modeled/3c57cca129580c393bb6994fbf088209879907efde712279eb6de9986ba6d457"}],"semantic_hash":"33ce2dc8028cc51e54b50536f44cfacd13b93f3cce8742e318d01e930927c201"}
